id,index,text,labels,label_code,pred_labels
445,20460749_s0,"Recent research has shown that the Na(+)/K(+)-ATPase alpha1 subunit is a novel anti-cancer target , which plays pivotal roles in malignant cell ion transport , metabolism , migration and signal transduction .",,[0. 0. 0. 0. 0. 0. 0. 0. 0. 0.],[]
446,20661828_s7,"In contrast , the expression of cyclins A and E were found to be decreased in mixed-tocotrienol groups .",sustaining proliferative signaling,[0. 0. 0. 0. 0. 0. 0. 0. 1. 0.],[]
447,23359693_s3,"We report an important mechanism for this antagonism , inhibition of Hippo pathway signaling by mitogenic growth factors .",sustaining proliferative signaling,[0. 0. 0. 0. 0. 0. 0. 0. 1. 0.],[]
448,23285288_s6,"We found a selection of DNA repair genes , including some not previously reported , that are modulated in response to radiation .",genomic instability and mutation,[0. 0. 0. 0. 0. 1. 0. 0. 0. 0.],[]
449,12219835_s3,It was found that Walker carcinosarcoma cells moving in a dense population neither show contact inhibition of movement when colliding with one another nor increase their motile activity as a result of contact stimulation of motility .,evading growth suppressors,[0. 0. 0. 0. 1. 0. 0. 0. 0. 0.],[]
450,1480490_s8,"Particular genes , c-myc , fos and p53 , were found on broad distributions of photocleaved fragment lengths .",,[0. 0. 0. 0. 0. 0. 0. 0. 0. 0.],[]
451,22053106_s1,"To study its biologic function in myeloid cells , dominant-negative PPARÎ³ ( dnPPARÎ³ ) was overexpressed in a myeloid-specific bitransgenic mouse model .",,[0. 0. 0. 0. 0. 0. 0. 0. 0. 0.],[]
452,20101074_s3,"In this work , we propose a new strategy based on the combination of platinum nanoparticles with irradiation by fast ions effectively used in hadron therapy .",,[0. 0. 0. 0. 0. 0. 0. 0. 0. 0.],[]
453,22534171_s4,"In order to study the interaction of these pathways , ERK inhibitor ( PD98059 ) , PI3K inhibitors ( LY294002 , wortmannin ) , Akt inhibitor ( A6730 ) , and EGFR inhibitor ( erlotinib ) as well as the corresponding siRNAs were used to treat MDA-MB-231 cells , and ovarian cancer OVCAR-3 and SKOV-3 cells .",,[0. 0. 0. 0. 0. 0. 0. 0. 0. 0.],[]
454,21975289_s7,The percentage of CD25+ in the CD4+ T cells in tumor tissue was positively correlated with tumor sizes ( r = 0.556 ) .,tumor promoting inflammation,[0. 0. 0. 0. 0. 0. 0. 0. 0. 1.],[]
455,22277962_s4,DNA strand breaks were detected by the alkaline comet assay .,,[0. 0. 0. 0. 0. 0. 0. 0. 0. 0.],[]
456,12460794_s4,"Median IgG concentration decreased from 1,526 mg/dL in the group with the lowest ( &lt ; 3.5 ppt ) TCDD levels to 1,163 mg/dL in the group with the highest ( 20.1-89.9 ppt ) TCDD levels ( p = 0.002 ) .",avoiding immune destruction,[0. 1. 0. 0. 0. 0. 0. 0. 0. 0.],[]
457,23205094_s3,"In the current study , the effect of MSCs on the hypoxia-induced desensitization of the Î²2AR in OS cells was investigated .",,[0. 0. 0. 0. 0. 0. 0. 0. 0. 0.],[]
458,23128605_s3,"FUT1 encodes Î±1,2-fucosyltransferase , a key enzyme for LeY synthesis .",,[0. 0. 0. 0. 0. 0. 0. 0. 0. 0.],[]
459,12430006_s9,"The 15% olive-oil diet increased all areas of the lymph nodes in tumor-free rats , while in tumor-bearing rats , this diet increased the areas of the cortex and mantle layer .",,[0. 0. 0. 0. 0. 0. 0. 0. 0. 0.],[]
460,23271806_s3,"However , we found that tumor cells have few phenotypical differences after surgery .",,[0. 0. 0. 0. 0. 0. 0. 0. 0. 0.],[]
461,1556770_s5,"Six of the nine late-passage , but none of the early-passage , cell lines tested exhibited a capacity for substrate-independent growth that was augmented in a dose-dependent manner by epidermal growth factor .",sustaining proliferative signaling,[0. 0. 0. 0. 0. 0. 0. 0. 1. 0.],[]
462,23298485_s2,Twenty-five cases of human HA tissues were collected .,,[0. 0. 0. 0. 0. 0. 0. 0. 0. 0.],[]
463,20588232_s5,METHODS The levels of cytokines were measured using ELISA sets .,,[0. 0. 0. 0. 0. 0. 0. 0. 0. 0.],[]
464,21188144_s10,CONCLUSIONS/SIGNIFICANCE We conclude that PTH-induced bone formation in myelomatous bones is mediated by activation of multiple signaling pathways involved in osteoblastogenesis and attenuated bone resorption and myeloma growth ; mechanisms involve increased osteoblast production of anti-myeloma factors and minimized myeloma induction of inflammatory conditions .,,[0. 0. 0. 0. 0. 0. 0. 0. 0. 0.],[]
465,23027128_s6,"Expression of membrane-targeted active PTK6 ( Palm-PTK6-YF ) induces constitutive activation of FAK and cell morphology changes , which are independent of SRC family kinases in Src-/- , Yes-/- , Fyn-/- ( SYF ) mouse embryonic fibroblasts ( MEFs ) .",,[0. 0. 0. 0. 0. 0. 0. 0. 0. 0.],[]
466,22876288_s3,Forced expression of miR-7 produced increased E-CADHERIN and decreased FIBRONECTIN and VIMENTIN expression in breast cancer cells .,,[0. 0. 0. 0. 0. 0. 0. 0. 0. 0.],[]
467,21318160_s4,"These data suggest TPO-R agonists will likely preferentially stimulate proliferation and differentiation of cells of megakaryocytic lineage , potentially demonstrating their utility for correcting thrombocytopenia in clinical settings .",,[0. 0. 0. 0. 0. 0. 0. 0. 0. 0.],[]
468,20000475_s1,Previous studies have shown that DU has both chemical and radiological toxicity and that the primary route of exposure of DU to humans is through inhalation and ingestion .,,[0. 0. 0. 0. 0. 0. 0. 0. 0. 0.],[]
469,12490541_s7,The results revealed significant improvement in migration equal to those levels seen in healthy donors .,,[0. 0. 0. 0. 0. 0. 0. 0. 0. 0.],[]
470,20225150_s2,"In Drosophila melanogaster , the BLM ortholog ( DmBlm ) is encoded by the mus309 gene .",,[0. 0. 0. 0. 0. 0. 0. 0. 0. 0.],[]
471,20184723_s5,"Down regulated genes represented nonimmune processes , such as development , metabolism and transport .",,[0. 0. 0. 0. 0. 0. 0. 0. 0. 0.],[]
472,22916133_s2,"However , to date , no information is available regarding the genetics of PGF variability .",,[0. 0. 0. 0. 0. 0. 0. 0. 0. 0.],[]
473,12533046_s1,ATO can degrade chimeric PML-RAR proteins and induce apoptosis in various cancer cells .,,[0. 0. 0. 0. 0. 0. 0. 0. 0. 0.],[]
474,20303261_s3,"The primary goal of the current study was to evaluate the therapeutic effects of lower doses of both agents when given in combination to mice with SERM sensitive , oestrogen stimulated tumour xenografts ( MCF-7 E2 tumours ) .",,[0. 0. 0. 0. 0. 0. 0. 0. 0. 0.],[]
475,22505206_s0,Manipulating acetylation status of key gene targets is likely to be crucial for effective cancer therapy .,,[0. 0. 0. 0. 0. 0. 0. 0. 0. 0.],[]
476,19815061_s2,"In this study , manganese toxicity was investigated using cultured T98G cells , which are derived from human glioblasts with the ability to differentiate into several different types of neuroglia .",,[0. 0. 0. 0. 0. 0. 0. 0. 0. 0.],[]
477,20303261_s13,Molecular analysis revealed a decreased phosphorylation of VEGFR-2 in tumours that were treated with brivanib alaninate and an increase in VEGFA transcription to compensate for the blockade of VEGFR-2 by increasing the transcription of VEGFA .,,[0. 0. 0. 0. 0. 0. 0. 0. 0. 0.],[]
478,23255896_s1,"In this study , we explored in vitro the antitumor effects of sorafenib alone and in combination with gemcitabine in epidermal growth factor receptor-tyrosine kinase inhibitor ( EGFR-TKI)-resistant human lung cancer cell lines and the related molecular mechanisms .",,[0. 0. 0. 0. 0. 0. 0. 0. 0. 0.],[]
479,20812283_s4,The aim of the work was to investigate the antiinflammatory action of verbascoside using a concentration of 100 mum .,,[0. 0. 0. 0. 0. 0. 0. 0. 0. 0.],[]
480,22981962_s4,"Groups II , III and IV received topical application of TPA at the dose of 10 nmol/0.2 ml of acetone/animal/day , for 2 days .",,[0. 0. 0. 0. 0. 0. 0. 0. 0. 0.],[]
481,22108827_s7,"In addition , we have delineated a feedback loop involving the androgen receptor and the Zeb1 transcription factor that seems to mediate this transition .",sustaining proliferative signaling,[0. 0. 0. 0. 0. 0. 0. 0. 1. 0.],[]
482,20000475_s5,We also characterized these DU-induced transformed cell lines and found that 40% of the cell lines exhibit alterations in plating efficiency and no significant changes in the cytotoxic response to DU .,,[0. 0. 0. 0. 0. 0. 0. 0. 0. 0.],[]
483,23383661_s7,"Moreover , the T1762/A1764 mutations in the BCP region in combination with either T1653 or A1896 were more common in the HCC compared with the CHB group ( BCP+X1653 : 18% vs 11% , P = 0.05 ; BCP+PC , 40% vs 15% , P &lt ; 0.001 , respectively ) .",genomic instability and mutation,[0. 0. 0. 0. 0. 1. 0. 0. 0. 0.],[]
484,23123564_s1,"A common genetic mutation found in ccRCC is the loss of the von Hippel-Lindau ( VHL ) gene , which contributes to cancer progression and metastasis .",,[0. 0. 0. 0. 0. 0. 0. 0. 0. 0.],[]
485,15195129_s15,There were no observed side effects of the treatment .,,[0. 0. 0. 0. 0. 0. 0. 0. 0. 0.],[]
486,22981203_s1,Prostate cancer is the most frequently diagnosed malignancy and the second-leading cause of cancer death in men .,,[0. 0. 0. 0. 0. 0. 0. 0. 0. 0.],[]
487,23285698_s1,Agents capable of inducing apoptosis in prostate cancer cells seem a promising approach to treat this malignancy .,,[0. 0. 0. 0. 0. 0. 0. 0. 0. 0.],[]
488,23170250_s6,"In addition , we found that necrotic cells contain factors that can block the cross-priming of CD8(+) T cells even under non-sterile conditions and can serve as a possible mechanism of immunosuppression .","avoiding immune destruction,resisting cell death",[0. 1. 0. 0. 0. 0. 0. 1. 0. 0.],[]
489,12234411_s7,"C225 treatment produced significant cytotoxicity in all three EGFR-amplified GBM lines , but not in unamplified lines .",,[0. 0. 0. 0. 0. 0. 0. 0. 0. 0.],[]
490,20856226_s1,The mechanism of the development of CK19-positive HCC remains to be studied .,,[0. 0. 0. 0. 0. 0. 0. 0. 0. 0.],[]
491,20385015_s9,"Differential strain responses in inflammation were positively associated with elevated levels of the chemokines KC and MCP-1 , higher NFkappaB and c-Fos binding activity , as well as sustained ERK1/2 activation in lung tissue .",tumor promoting inflammation,[0. 0. 0. 0. 0. 0. 0. 0. 0. 1.],[]
492,23083134_s3,BT474 IBDC cell migration and invasion were quantified using the Transwell assay .,,[0. 0. 0. 0. 0. 0. 0. 0. 0. 0.],[]
493,11724768_s5,These findings raise the possibility that ghrelin modulates insulin activities in humans .,,[0. 0. 0. 0. 0. 0. 0. 0. 0. 0.],[]
494,20497549_s14,These findings provide novel guidelines and strategy for imaging and treatment of necrotic tumors .,resisting cell death,[0. 0. 0. 0. 0. 0. 0. 1. 0. 0.],[]
495,20332304_s9,Tumor multiplicity also decreased with resveratrol treatment .,,[0. 0. 0. 0. 0. 0. 0. 0. 0. 0.],[]
496,11986236_s3,"Furthermore , MLL-AF10-transduced cells rapidly induced acute myeloid leukemia in syngeneic or severe combined immunodeficiency recipient mice .",,[0. 0. 0. 0. 0. 0. 0. 0. 0. 0.],[]
497,22934451_s8,Pulmonary metastases were detected in 26 patients by either CXR or CT scan .,activating invasion and metastasis,[1. 0. 0. 0. 0. 0. 0. 0. 0. 0.],[]
498,20707650_s9,"Furthermore , by studying the kinetics of cell death and apoptosis , we found that the loss of cell membrane integrity preceded the DNA fragmentation in both L929 and rL929 cells .",,[0. 0. 0. 0. 0. 0. 0. 0. 0. 0.],[]
499,12202630_s0,"Dimethyl sulfoxide ( DMSO ) , a well-known differentiation inducer in several myeloid cells , also induces a reversible G(1) arrest in many cell lines .",,[0. 0. 0. 0. 0. 0. 0. 0. 0. 0.],[]
500,23346016_s6,Apoptosis was significantly augmented and cell proliferation was inhibited .,"resisting cell death,sustaining proliferative signaling",[0. 0. 0. 0. 0. 0. 0. 1. 1. 0.],[]
501,20696059_s13,Treatment with such combinations may have benefit for breast cancer patients .,,[0. 0. 0. 0. 0. 0. 0. 0. 0. 0.],[]
502,1394185_s5,"UDS was quantitated autoradiographically as net grains per nucleus ( nuclear grains minus cytoplasmic background , population average ) with &gt ; or = 6 net nuclear grains considered in repair for any individual cell .",,[0. 0. 0. 0. 0. 0. 0. 0. 0. 0.],[]
503,20878069_s4,Four patients with typical clinical outcome represented the control group .,,[0. 0. 0. 0. 0. 0. 0. 0. 0. 0.],[]
504,20580968_s5,"As examples , we describe the application of these methods to the study of proteins involved in recombination-mediated DNA repair , a process essential for the maintenance of genomic integrity .",genomic instability and mutation,[0. 0. 0. 0. 0. 1. 0. 0. 0. 0.],[]
505,22387176_s2,"Although the exact mechanisms underlying radiation-induced late effects remain unclear , oxidative stress and inflammation are thought to play a critical role .",,[0. 0. 0. 0. 0. 0. 0. 0. 0. 0.],[]
506,22832494_s2,We have used the Sleeping Beauty transposon/transposase system to identify somatic mutations associated with NMSC .,,[0. 0. 0. 0. 0. 0. 0. 0. 0. 0.],[]
507,24148623_s7,"Collectively , our studies establish PDK1 as a key driver and candidate therapeutic target in glioblastoma multiforme .",,[0. 0. 0. 0. 0. 0. 0. 0. 0. 0.],[]
508,12528894_s8,The results suggested that the rIL-16 might be a regulator for the growth or apoptosis of Jurkat cells at a dose-dependent manner .,resisting cell death,[0. 0. 0. 0. 0. 0. 0. 1. 0. 0.],[]
509,23064360_s6,"Loss of TNFRs impaired the induction of MDSCs from bone marrow cells , but this could be reversed by treatment with caspase inhibitors .",,[0. 0. 0. 0. 0. 0. 0. 0. 0. 0.],[]
510,23174717_s11,Further studies need to be conducted to validate these findings .,,[0. 0. 0. 0. 0. 0. 0. 0. 0. 0.],[]
511,15195129_s12,"Our in vivo studies showed that a local AIC injection of 50 microCi at 2 days post-cell inoculation gave complete inhibition of tumor growth , whereas results for a non-specific AIC were similar to those for untreated mice .",,[0. 0. 0. 0. 0. 0. 0. 0. 0. 0.],[]
512,20334580_s3,"Compared with control cells , cells overexpressing wild-type DHHC20 displayed an increase in palmitoylation activity toward a peptide that mimics the N-terminus of myristoylated and palmitoylated proteins , but had no change in activity toward a peptide that mimics the C-terminus of farnesylated and palmitoylated proteins .",,[0. 0. 0. 0. 0. 0. 0. 0. 0. 0.],[]
513,23317266_s1,Health benefits have been linked to additive and synergistic combinations of phytochemicals in fruits and vegetables .,,[0. 0. 0. 0. 0. 0. 0. 0. 0. 0.],[]
514,20215500_s0,Targeting cancer cell metabolism is a new promising strategy to fight cancer .,,[0. 0. 0. 0. 0. 0. 0. 0. 0. 0.],[]
515,23128605_s6,"Knocking down FUT1 expression markedly inhibited proliferation of NCI-N87 , which highly expressed EGFR and was sensitive to EGFR deprivation .",sustaining proliferative signaling,[0. 0. 0. 0. 0. 0. 0. 0. 1. 0.],[]
516,12181065_s3,Enforced HOX11 expression was found to induce a profound alteration in J2E cellular morphology and differentiation status .,,[0. 0. 0. 0. 0. 0. 0. 0. 0. 0.],[]
517,22848179_s0,BACKGROUND Agricultural products and by products provide the primary materials for a variety of technological applications in diverse industrial sectors .,,[0. 0. 0. 0. 0. 0. 0. 0. 0. 0.],[]
518,20190398_s0,"The aryl hydrocarbon receptor ( AhR ) is a ligand-activated transcription factor that mediates a spectrum of toxic and biological effects of 2,3,7,8-tetrachlorodibenzo-p-dioxin and related compounds .",,[0. 0. 0. 0. 0. 0. 0. 0. 0. 0.],[]
519,23308053_s2,"Using cervical cancer as a model of investigation , we have previously shown that loss of NOL7 mRNA and protein expression is observed as early as the premalignant phase .",,[0. 0. 0. 0. 0. 0. 0. 0. 0. 0.],[]
520,12192110_s8,"Serum luteinizing hormone ( LH ) , follicle-stimulating hormone ( FSH ) , prolactin ( PRL ) , and estradiol were measured by radioimmunoassay .",,[0. 0. 0. 0. 0. 0. 0. 0. 0. 0.],[]
521,22357207_s4,"The results showed that leptin/Ob-R expression was significantly associated with T stage , TNM stage , lymph node metastasis , distant metastasis , differentiation and expression of p-mTOR , p-70S6 kinase , and p-Akt .",activating invasion and metastasis,[1. 0. 0. 0. 0. 0. 0. 0. 0. 0.],[]
522,21057538_s7,We suggest that therapeutic strategies designed to simultaneously target both VEGF and FGF2 signalling may prove more efficacious than sunitinib in renal cancer patients whose tumours express FGF2 .,,[0. 0. 0. 0. 0. 0. 0. 0. 0. 0.],[]
523,12445208_s5,Geranylation was also found to be necessary for full downstream activation of serum response factor mediated transcription .,,[0. 0. 0. 0. 0. 0. 0. 0. 0. 0.],[]
524,14578017_s4,DNA SSB levels were found to be significantly higher in smoking controls compared to non-smoking controls .,genomic instability and mutation,[0. 0. 0. 0. 0. 1. 0. 0. 0. 0.],[]
525,22858906_s7,"Such knowledge , combined with known remaining sensitivity to other FLT3 TKI , will be important to establish as secondary drug treatments that can be substituted when these mutants are encountered .",,[0. 0. 0. 0. 0. 0. 0. 0. 0. 0.],[]
526,23198967_s5,"Our results demonstrate that the rate limiting step is Michael addition between BPAQ and dA , the main product being the unstable N7-modified adduct that rapidly undergoes depurination .",genomic instability and mutation,[0. 0. 0. 0. 0. 1. 0. 0. 0. 0.],[]
527,22883469_s6,This finding has important implications for the development of targeted therapeutics for a number of EGFR-addicted cancers .,sustaining proliferative signaling,[0. 0. 0. 0. 0. 0. 0. 0. 1. 0.],[]
528,1384375_s4,"With one exception , all the patients had at least a single recurrences of their primary mixed tumor , but two or more recurrences were the norm before development of metastatic foci .",activating invasion and metastasis,[1. 0. 0. 0. 0. 0. 0. 0. 0. 0.],[]
529,23147699_s4,"The polymorphisms of codon 118 ( rs11615 ) and C8092A ( rs3212986 ) of ERCC1 , codon 751 ( rs13181 ) , 312 ( rs1799793 ) and 156 ( rs238406 ) of ERCC2/XPD were genotyped by TaqMan(®) Real-time PCR .",,[0. 0. 0. 0. 0. 0. 0. 0. 0. 0.],[]
530,20460749_s3,"Using the ouabain and Na(+)/K(+)-ATPase alpha1 subunit siRNA , which target the Na(+)/K(+)-ATPase , we have evaluated the effects of inhibiting Na(+)/K(+)-ATPase alpha1 in human HepG2 cells with respect to cell proliferation , morphology , cell cycle , impact on intracellular Ca2++ , reactive oxygen species ( ROS ) concentration , and correlated gene expression level on messenger ribonucleic acid ( mRNA ) and protein .",,[0. 0. 0. 0. 0. 0. 0. 0. 0. 0.],[]
531,22838389_s2,The expression of the newly identified gene metastasis associated in colon cancer 1 ( MACC1 ) is a prognostic indicator for colon cancer metastasis .,,[0. 0. 0. 0. 0. 0. 0. 0. 0. 0.],[]
532,23149922_s5,"Cancer cells overexpressing MIG-7 exhibited increased expression of ZEB-1 and Twist in parallel with epithelial-mesenchymal transition , metastasis and cancer lethality .",activating invasion and metastasis,[1. 0. 0. 0. 0. 0. 0. 0. 0. 0.],[]
533,22968518_s2,Double immunohistochemical staining with antibodies against lymphatic vessel endothelial hyaluronan receptor 1 and Ki-67 was used to label the lymphatic vessels and mark the proliferative lymphatic vessels in cervical squamous cancer .,,[0. 0. 0. 0. 0. 0. 0. 0. 0. 0.],[]
534,23292149_s9,"Significantly , complete tumor suppression was obtained by co-injecting TNF-alpha expressing stromal fibroblasts with human breast cancer cells , indicating that paracrine cell-mediated delivery of TNF-alpha can also prevent tumor engraftment and growth ( 0 tumors/10 injections ) .",,[0. 0. 0. 0. 0. 0. 0. 0. 0. 0.],[]
535,22264502_s5,"RESULTS : We showed that expression PlncRNA-1 , was significantly higher in CaP cells relative to normal prostate epithelial cells , as well as higher in human CaPs compared with normal tissues and benign prostatic hyperplasia ( BPH ) .",,[0. 0. 0. 0. 0. 0. 0. 0. 0. 0.],[]
536,12060611_s0,"PURPOSE Astrocytoma arises in the central nervous system as a tumor of great lethality , in part because of the invasive potential of the neoplastic cells that are able to release extracellular matrix-degrading enzymes .",,[0. 0. 0. 0. 0. 0. 0. 0. 0. 0.],[]
537,23275086_s2,"We hypotheses that PTEN gene could affect the growth and viability of ASMCs through the regulation of PI3K/Akt , MAPK , and cell cycle-related gene expression .",,[0. 0. 0. 0. 0. 0. 0. 0. 0. 0.],[]
538,20514026_s4,"Functionally , RNAi-mediated knockdown of RASSF8 in non-small-cell lung cancer ( NSCLC ) cell lines , increased anchorage-independent growth in soft agar and enhanced tumor growth in severe combined immunodeficiency ( SCID ) mice .",,[0. 0. 0. 0. 0. 0. 0. 0. 0. 0.],[]
539,20092614_s10,"In addition , we elucidate for the first time the contribution of these aspects to consequent phenotype changes in epithelial cells .",,[0. 0. 0. 0. 0. 0. 0. 0. 0. 0.],[]
540,23772374_s3,"After successful knockdown of PrxIII expression by small interfering RNA , we evaluated ROS level , viable cell number , and apoptosis of cervical cancer cells along with the culture time .",,[0. 0. 0. 0. 0. 0. 0. 0. 0. 0.],[]
541,20417553_s4,The aim of the present study was to better investigate the link between PAH exposure and genotoxicity in marine flatfish .,,[0. 0. 0. 0. 0. 0. 0. 0. 0. 0.],[]
542,24068038_s4,"After 24weeks , chronic arsenic-exposed breast epithelial ( CABE ) cells showed increases in secreted MMP activity , colony formation , invasion , and proliferation rate , indicating an acquired cancer cell phenotype .",activating invasion and metastasis,[1. 0. 0. 0. 0. 0. 0. 0. 0. 0.],[]
543,23185784_s4,"Considering that cyclophosphamide is a prodrug , we used mafosfamide , a compound that yields in vitro the same active metabolites as cyclophosphamide does in vivo .",,[0. 0. 0. 0. 0. 0. 0. 0. 0. 0.],[]
544,20358470_s5,"Overall , F&amp;V did not affect DNA damage and repair measures in lymphocytes .",genomic instability and mutation,[0. 0. 0. 0. 0. 1. 0. 0. 0. 0.],[]
545,20333679_s6,Induction of IFN-Î³ 2-3 weeks after tumor cell inoculation was less efficient ( 0-17% rejection ) .,,[0. 0. 0. 0. 0. 0. 0. 0. 0. 0.],[]
546,23073801_s7,"The results showed that p120ctn knockdown led to significantly down-regulated E-cadherin and a reduced cell-to-cell adhesion ability in PANC-1 cells. shRNA-mediated knockdown of p120ctn reduced invasion and migration capacity of PANC-1 cells , inhibited cell growth , caused a significant decrease in the percentage of cells in G(1) , an increase in S , and promoted apoptosis of PANC-1 cells .",,[0. 0. 0. 0. 0. 0. 0. 0. 0. 0.],[]
547,22970388_s8,Primary tumor samples were available for four of the six patients assessed for PIK3CA status in their bone metastases .,activating invasion and metastasis,[1. 0. 0. 0. 0. 0. 0. 0. 0. 0.],[]
548,22665055_s1,Hypoxia-inducible factor ( HIF ) and oncoprotein Myc are two prominent transcription factors that drive glycolysis .,,[0. 0. 0. 0. 0. 0. 0. 0. 0. 0.],[]
549,23028579_s1,This could be relevant because the type of DNA damage could have different effects .,,[0. 0. 0. 0. 0. 0. 0. 0. 0. 0.],[]
550,23235164_s3,"From January 1993 to January 2011 , 73 patients underwent hepatectomy for GLM in the Department of Gastroenterological Surgery , Cancer Institute Ariake Hospital(Japanese Foundation for Cancer Research ) , Japan .",,[0. 0. 0. 0. 0. 0. 0. 0. 0. 0.],[]
551,22150625_s0,"OBJECTIVE The HER2 receptor is involved in pathways essential for cell proliferation , and is an important predictive and prognostic factor in breast cancer .",,[0. 0. 0. 0. 0. 0. 0. 0. 0. 0.],[]
552,20954073_s8,These data reveal that PP2A is a regulator of ceramide-induced p27(kip1) expression via Akt-dependent and Akt-independent pathways .,"evading growth suppressors,sustaining proliferative signaling",[0. 0. 0. 0. 1. 0. 0. 0. 1. 0.],[]
553,23085987_s1,"Here , we demonstrate that Wig1 plays a critical role in this process through regulation of p21 mRNA stability .",,[0. 0. 0. 0. 0. 0. 0. 0. 0. 0.],[]
554,24367685_s2,"However , the mechanism underlying this selectivity is unknown .",,[0. 0. 0. 0. 0. 0. 0. 0. 0. 0.],[]
555,12507933_s3,"Consistent with this profile , cyclooxygenase 2 ( Cox2 ) was overexpressed in the basal cell layer of esophageal squamous epithelium , CLE cells and EAC tumor cells of the EGDA rats , as compared with the normal esophageal epithelium .",,[0. 0. 0. 0. 0. 0. 0. 0. 0. 0.],[]
556,23258707_s4,The unique hairpin bypass of pol β resulted in large and small deletions in coordination with FEN1 alternate flap cleavage .,,[0. 0. 0. 0. 0. 0. 0. 0. 0. 0.],[]
557,12450390_s10,"We conclude from this study that the mutation potential of dG-AAF and dG-AF depends on the structure of the adduct , the sequence context of the lesion , and the host cell used for the experiment .",genomic instability and mutation,[0. 0. 0. 0. 0. 1. 0. 0. 0. 0.],[]
558,23263278_s0,The mechanisms by which tumour cells metastasize and the role that cell polarity proteins play in this process are not well understood .,,[0. 0. 0. 0. 0. 0. 0. 0. 0. 0.],[]
559,23300545_s6,"Therefore , the elevation in inflammatory serum biomarkers may reflect a pathological state that decreases the clinical efficacy of this therapy .",tumor promoting inflammation,[0. 0. 0. 0. 0. 0. 0. 0. 0. 1.],[]
560,23100610_s0,OBJECTIVE To evaluate the risk factors for sentinel lymph node metastasis and validate the value of the Memorial Sloan-Kettering Cancer Center nomogram for the prediction of sentinel lymph node metastasis in breast cancer patients .,,[0. 0. 0. 0. 0. 0. 0. 0. 0. 0.],[]
561,22982677_s3,"Vice versa , anti-proliferative signals , such as TGF-β and differentiation signals decrease FoxM1 expression .",,[0. 0. 0. 0. 0. 0. 0. 0. 0. 0.],[]
